Title,Link,ID,Date,Description
Principal Data Scientist,https://www.indeed.com/rc/clk?jk=902a926bda917e21&fccid=deb234f9dd3edcea&vjs=3,job_902a926bda917e21,20 days ago,"Job Description:
The Role
Do you want to work at the epicenter of new and emerging technologies? Not just tinkering around the edges, rather building critical solutions that will benefit our teams for years to come. Those who love to work with data may see this as the pinnacle of opportunities anywhere in the industry. Asset Management’s Advanced Process Solutions team is seeking a Senior Data Scientist with experience in Generative Large Language Models, Natural Language Processing, Machine learning, various Deep Learning related technologies, predictive and prescriptive analytics. If you want to build, design, and implement machine learning applications, such as: modeling, data ingestion, building data pipelines, writing APIs; as well as, designing and implementing natural language processing (NLP) and other machine learning algorithms, then this is the role for you!
The role will be available in Boston, MA; Merrimack, NH; Smithfield, RI; or Durham, NC.
The Expertise and Skills You Bring
Deep understanding of Machine Learning & Deep Learning algorithms
Proven experience working with business partners to understand their problem, design and model a solution, and bring a prototype to market efficiently
Knowledge or experience with embedding models and large language models – Llama 2, OpenAI products, Langchain, multimodal embeddings
Knowledge of most of the following quantitative fields: Natural Language Processing, OCR Information Retrieval, Machine Comprehension, Question Answering, Reinforcement Learning, Knowledge Graph, Causal Inference, and Design of Experiment
Programming skills and experience, such as Python, Scikit Learn, PyTorch etc.
Expertise in navigating large data sets (structured and unstructured), discovering, cleaning, analyzing, and preparing data for ingestion
Experience building and hosting data pipelines and RESTful APIs
Professional experience building scalable applications in AWS
Familiarity with CI/CD and DevOps standard methodologies and/or ML-Ops
Additional technical skills that are nice to have: Snowflake, JavaScript, Spark, Serverless, Jenkins, Concourse, NoSQL databases, Tableau, R, Linux
A creative problem solver, who thrives on working through complex challenges and is fueled by a natural curiosity to keep up with continuous advancements and trends in technology
Strong technical foundation with an ability to learn new skills and technologies as needed
Great collaboration and interpersonal skills while also demonstrating the ability to be self-starter and independent thinker
Strong communication and presentation skills, with a ability to explain complex technical/analytical concepts to audiences at all levels (technical and non-technical)
Computer science / mathematics / quantitative educational background
Working knowledge of Investment Management business domain knowledge across some combination of Research, Portfolio Management, Trading, Compliance, and Investment Operations is helpful, but not necessary
Bachelors or equivalent with 5+ years of experience or Masters with 3+ years of experience
The Team
The Advanced Process Solutions Emerging Solutions is on the frontier of emerging technology and delivers innovative, scalable, industry-leading tools that enable Asset Management to achieve competitive advantage globally. Our work in this truly groundbreaking initiative will provide a major contribution to Asset Management’s business operations and scale and efficiency objectives.
Certifications:
Company Overview
Fidelity Investments is a privately held company with a mission to strengthen the financial well-being of our clients. We help people invest and plan for their future. We assist companies and non-profit organizations in delivering benefits to their employees. And we provide institutions and independent advisors with investment and technology solutions to help invest their own clients' money.

Join Us
At Fidelity, you'll find endless opportunities to build a meaningful career that positively impacts peoples' lives, including yours. You can take advantage of flexible benefits that support you through every stage of your career, empowering you to thrive at work and at home. Honored with a Glassdoor Employees' Choice Award, we have been recognized by our employees as a Best Place to Work in 2023. And you don't need a finance background to succeed at Fidelity—we offer a range of opportunities for learning so you can build the career you've always imagined.
At Fidelity, our goal is for most people to work flexibly in a way that balances both personal and business needs with time onsite and offsite through what we’re calling “Dynamic Working”. Most associates will have a hybrid schedule with a requirement to work onsite at a Fidelity work location for at least one week, 5 consecutive days, every four weeks. These requirements are subject to change.
We invite you to Find Your Fidelity at fidelitycareers.com.

Fidelity Investments is an equal opportunity employer. We believe that the most effective way to attract, develop and retain a diverse workforce is to build an enduring culture of inclusion and belonging.
Fidelity will reasonably accommodate applicants with disabilities who need adjustments to participate in the application or interview process. To initiate a request for an accommodation, contact the HR Accommodation Team by sending an email to accommodations @fmr.com, or by calling 800-835-5099, prompt 2, option 3.
At Fidelity, we value honesty, integrity, and the safety of our associates and customers within a heavily regulated industry. Certain roles may require candidates to go through a preliminary credit check during the screening process. Candidates who are presented with a Fidelity offer will need to go through a background investigation and may be asked to provide additional documentation as requested. This investigation includes but is not limited to a criminal, civil litigations and regulatory review, employment, education, and credit review (role dependent). These investigations will account for 7 years or more of history, depending on the role. Where permitted by federal or state law, Fidelity will also conduct a pre-employment drug screen, which will review for the following substances: Amphetamines, THC (marijuana), cocaine, opiates, phencyclidine."
"Research Scientist Model Engineer, Autonomous Startup",https://www.indeed.com/rc/clk?jk=d009b38ad5cd1a9f&fccid=09e02654c2f26bbd&vjs=3,job_d009b38ad5cd1a9f,,"Who is Recruiting from Scratch:
Recruiting from Scratch is a premier talent firm that focuses on placing the best product managers, software, and hardware talent at innovative companies. Our team is 100% remote and we work with teams across the United States to help them hire. We work with companies funded by the best investors including Sequoia Capital, Lightspeed Ventures, Tiger Global Management, A16Z, Accel, DFJ, and more.
https://www.recruitingfromscratch.com/
About Our Client
At our client, their mission is to make self-driving for everyone. They build autonomous driving software for automakers, based on a breakthrough in artificial intelligence that finally makes highway autonomy safe and scalable for the consumer car market.
Our client has 100+ employees across its headquarters in Mountain View and additional offices in Dallas and Sydney. They have raised $165 million from investors including Mike Speiser at Sutter Hill Ventures, Keith Rabois at Founders Fund, and Vinod Khosla at Khosla Ventures.
The Role

As a Model Engineer at our client, you will be responsible for building and testing the models that literally drive our vehicles. Operating on the noisy data of a real-world environment, the problems you face will be complex and open-ended, and the solutions you create have the potential for enormous impact. With a proven founding team and compelling plan, our client knows where it is going - but how it gets there will be up to you.
Requirements:
You likely have a PhD in Software, Physics, Electrical Engineering, or similar disciplines
Professional experience working with real-world, physical data
A track record of having shipped models and code into production
Strong programming skills in object-oriented languages (functional programming is a plus), including ability to debug and optimize code
Ability to fine tune GPT models
Working knowledge of machine learning, data engineering, deep learning frameworks, and related testing techniques
Base Salary
Compensation for this role consists of a base salary and an options grant, with the base salary expected to range from $175,000 to $275,000+. Individual compensation will be commensurate with the candidate’s experience.
https://www.recruitingfromscratch.com/"
"Fullstack Developer (Hybrid. Raleigh, NC)",https://www.indeed.com/rc/clk?jk=15563fd6e6dfa86e&fccid=e5ba9f1c6d89d233&vjs=3,job_15563fd6e6dfa86e,,"Job Overview
We are seeking a highly skilled and motivated full-stack developer to join our expanding team. The primary focus of this role will be on developing robust, scalable, and maintainable generative AI, analytics, and business intelligence (BI) applications for our B2B clients. The successful candidate will play a pivotal role in the architecture, development, and deployment of these critical systems, working closely with data engineers, analysts, data scientists, and other stakeholders.
Responsibilities
Skills & Qualifications
Bachelor's degree in Computer Science, Software Engineering, or related field; Master's preferred.
Minimum of 3 years of full-stack development experience, preferably within AI and analytics applications.
Minimum 3 years of experience with both Azure and AWS cloud computing platforms
Minimum 6 months exposure to generative AI / LLM technology and applications
Strong proficiency in Python and JavaScript with experience using React, Angular, .NET, and Node.js
Experience with relational databases tools like MySQL and PostgreSQL, and NoSQL databases like MongoDB and Cosmos DB.
Familiarity with machine learning frameworks like TensorFlow, PyTorch, or scikit-learn.
Proficiency in Microsoft DevOps, Kubernetes, and CI/CD pipelines.
Exceptional problem-solving skills and attention to detail.
Ability to learn and apply new concepts rapidly
Excellent communication and teamwork abilities.
Development and Design
Architect, develop, and maintain full-stack applications that deliver high-impact generative AI and analytics solutions.
Develop user interfaces that are intuitive and provide exceptional user experience.
Collaborate with data scientists to implement machine learning models into applications.
Collaborate with data engineers to integrate applications with cloud-based data infrastructure built on Azure and AWS.
Collaboration and Communication
Work with cross-functional teams to translate business requirements into technical specifications.
Engage with internal stakeholders and clients to gather requirements, feedback, and insights for development.
Collaborate with project managers to ensure on-time delivery of high-quality products.
Thrive in fast-paced, time-sensitive projects and be able to juggle multiple development projects at once.
Quality Assurance and Testing
Write well-documented, efficient code that adheres to modern industry standards.
Develop and execute unit tests and participate in code reviews to maintain high code quality.
Assist in the preparation of documentation, including but not limited to, software requirements, API documentation, and end-user manuals and support videos.
Maintenance and Support
Provide ongoing support for deployed applications, including debugging, upgrades, and patches.
Monitor application performance and make improvements as necessary.
Collaborate with data engineers and scientists to ensure optimal application performance over time."
Advanced AI Research Scientist,https://www.indeed.com/rc/clk?jk=5a68b371daf67cce&fccid=a4e4e2eaf26690c9&vjs=3,job_5a68b371daf67cce,,"We Are
Accenture is helping companies use generative AI to reinvent their enterprise and optimize business functions for breakthrough innovation and competitive advantage. With over 1,600 professionals dedicated to generative AI, leveraging the depth and experience of more than 40,000 AI and data professionals across the company our Generative AI and LLM Center of Excellence brings together our Experienced Innovation, Strategic Investment, Exceptional Talent, and Power Ecosystem.
You Are
As an Advanced AI Research Scientist, you formulate real-world problems into practical, efficient, and scalable AI and Machine Learning problems.
You lead a team and provide guidance to explore and implement new methodologies, model building techniques, and cutting-edge algorithms, and applying these techniques with the right architecture to solve real-world problems.
You have a deep understanding and ability to remain at the forefront of generative AI, LLM, and multi-modal models (with a focus on driving innovation by applying these techniques to new business problems, use cases, and scenarios).
As needed by the specific problem, you train and/or fine-tune generative AI models and evaluate on the specific problem.
As a significant part of this role, you will be justifying the value of innovative generative AI or traditional Machine Learning approaches (or a combination of both) in the business problems, and you'll be expected to construct methodologies that clearly demonstrate their value.
You'll also work collaboratively with teams from both the business and technical side, including users, use case representatives, business owners, engineers, architects, and UI designers, to achieve end-to-end project development goals.
The Work
Participate internal and external discussions to gather business use case requirements, provide on the spot AI expertise and AI solution options for business problems.
Design, develop and implement advanced AI/ML models, especially LLM and other Gen AI models from scratch or existing foundation models via self-supervised learning, transferred-learning, and fine-tuning techniques.
Design, develop and implement highly sophisticated Gen AI based applications including generative agent and similar architectures which support multiple Gen AI models to work together for complex tasks.
Lead technical teams and grow true AI expertise within broader team including offshore
Collaborate seamlessly with diverse, cross-functional teams to accurately identify and prioritize requirements, ensuring that the AI solutions meets the needs and expectations of various stakeholders.
Develop and execute an AI solution project plan with team, timeline, and infrastructure dependency.
Define and implement a value justification approach to the AI solutions; estimate solution cost with right technological choices; and calculate ROI.
Create and maintain comprehensive technical documentation that comprehensibly captures the intricate details of the solution, capture IP, facilitating seamless understanding, knowledge transfer and future development.
Collaborate with academia partners to stay on the cutting edge of AI, especially Gen AI technologies, provide through leadership on AI trend, AI use case innovation trend, new AI opportunities, or foreseeable limitation, risks, and concerns.
Travel may be required for this role. The amount of travel will vary from 0 to 100% depending on business need and client requirements.

Here's What You Need
Minimum of 5 years of experience in designing and developing neural network models, especially deep learning model, and Foundation models.
Minimum of 5 years of experience of experience in building, fine-tuning Foundation models including LLMs and multi-modal models.
Minimum of 5 years of strong working knowledge of the different technologies, their differences, modalities in the Generate AI space.
Minimum of 5 years of working knowledge and familiarity with different LLM driven application architecture patterns.
Minimum of 5 years of experience in deep learning and neural networks, in particular training and large language models with popular libraries and GPUs.
Minimum of 5 years of working knowledge of computer architecture, and familiarity with the fundamentals of GPU architecture.
Minimum of 5 years of proven experience with processor and system-level performance modelling.
Minimum of 2 years of experience of technical team management or team mentoring.
Bachelor's degree or equivalent (minimum 12 years) work experience. (If Associate’s Degree, must have minimum 6 years work experience)
Compensation at Accenture varies depending on a wide array of factors, which may include but are not limited to the specific office location, role, skill set, and level of experience. As required by local law, Accenture provides a reasonable range of compensation for roles that may be hired in California, Colorado, New York or Washington as set forth below.
Information on benefits is here.
California $93,400 to $224,600
Colorado $93,400 to $194,100
New York $86,500 to $224,600
Washington $99,500 to $206,700

What We Believe

We have an unwavering commitment to diversity with the aim that every one of our people has a full sense of belonging within our organization. As a business imperative, every person at Accenture has the responsibility to create and sustain an inclusive environment.

Inclusion and diversity are fundamental to our culture and core values. Our rich diversity makes us more innovative and more creative, which helps us better serve our clients and our communities. Read more here

Equal Employment Opportunity Statement

Accenture is an Equal Opportunity Employer. We believe that no one should be discriminated against because of their differences, such as age, disability, ethnicity, gender, gender identity and expression, religion or sexual orientation.

All employment decisions shall be made without regard to age, race, creed, color, religion, sex, national origin, ancestry, disability status, veteran status, sexual orientation, gender identity or expression, genetic information, marital status, citizenship status or any other basis as protected by federal, state, or local law.

Accenture is committed to providing veteran employment opportunities to our service men and women.

For details, view a copy of the Accenture Equal Opportunity and Affirmative Action Policy Statement.

Requesting An Accommodation

Accenture is committed to providing equal employment opportunities for persons with disabilities or religious observances, including reasonable accommodation when needed. If you are hired by Accenture and require accommodation to perform the essential functions of your role, you will be asked to participate in our reasonable accommodation process. Accommodations made to facilitate the recruiting process are not a guarantee of future or continued accommodations once hired.

If you would like to be considered for employment opportunities with Accenture and have accommodation needs for a disability or religious observance, please call us toll free at 1 (877) 889-9009, send us an email or speak with your recruiter.

Other Employment Statements

Applicants for employment in the US must have work authorization that does not now or in the future require sponsorship of a visa for employment authorization in the United States.

Candidates who are currently employed by a client of Accenture or an affiliated Accenture business may not be eligible for consideration.

Job candidates will not be obligated to disclose sealed or expunged records of conviction or arrest as part of the hiring process.

The Company will not discharge or in any other manner discriminate against employees or applicants because they have inquired about, discussed, or disclosed their own pay or the pay of another employee or applicant. Additionally, employees who have access to the compensation information of other employees or applicants as a part of their essential job functions cannot disclose the pay of other employees or applicants to individuals who do not otherwise have access to compensation information, unless the disclosure is (a) in response to a formal complaint or charge, (b) in furtherance of an investigation, proceeding, hearing, or action, including an investigation conducted by the employer, or (c) consistent with the Company's legal duty to furnish information."
Data Scientist,https://www.indeed.com/rc/clk?jk=f11828db109fc321&fccid=9e215d88a6b33622&vjs=3,job_f11828db109fc321,3 days ago,"Are you an experienced, passionate pioneer in technology who wants to work in a collaborative environment? As an experienced Data Scientist, you will have the ability to share new ideas and collaborate on projects as a consultant without the extensive demands of travel. If so, consider an opportunity with Deloitte under our Project Delivery Talent Model. Project Delivery Model (PDM) is a talent model that is tailored specifically for long-term, onsite client service delivery.

Work you'll do/Responsibilities

This is an opportunity to join a fast-paced team that plays a key role in the overall success of our client's organization through technology enablement. You'll play a critical part in driving our client's technology vision forward and ensuring that we execute across multiple initiatives. Communicate regularly with Engagement Managers (Directors), project team members, and representatives from various functional and / or technical teams, including escalating any matters that require additional attention and consideration from engagement management.

Take deep dives in large-scale data to identify key insights that will shape future product strategy.

Perform diagnostic analyses, including ML/statistical modeling, multivariate testing and causal inference analyses, to quantify the lift of marketing campaigns.

Create data/model pipelines to automate recurring data pull and modeling process.

Conduct ad hoc descriptive analyses to identify key insights and opportunities.

Use Keynote and/or Tableau to visualize insights and deliver results in business presentations.

Independently and collaboratively lead client engagement workstreams focused on improvement, optimization, and transformation of processes including implementing leading practice workflows, addressing deficits in quality, and driving operational outcomes.

The Team

As a part of the US Strategy & Analytics Offering Portfolio, the AI & Data Engineering offering provides managed AI, Intelligent Automation, and Data DevOps services across the advise-implement-operate spectrum.

Qualifications

Required


Bachelor's degree, preferably in Computer Science, Information Technology, Computer Engineering, or related IT discipline; or equivalent experience
3+ years of experience in Data Science with a focus on product analytics. Equal parts business and technical savvy. Financial products exp. is nice to have.
Strong proficiency with SQL and Python coding. Experience querying and extracting info from Big data environments (spark) highly desirable.
Solid experience in handling large, complex, and fragmented datasets.
Experience developing pipelines with structured and unstructured data stored in distributed files systems with strong proficiency with SQL, Python and/or R. Preferred experience with packages such as pandas, sklearn, causal impact, stats models, forecast (R).
Hands-on experience with PySpark and data visualization tools.
Experience with campaign measurement and causal inference modeling.
Demonstrated experience with applying statistical rigor and machine learning techniques to derive insights from large complex data sets.
Strong background and knowledge in data analytics and statistical/ML modeling, including linear regression, multivariate analysis, classification, clustering, Etc.
Strong ability to condense and communicate sophisticated concepts and analysis into digestible insights and clear takeaways that drive action.
Demonstrate exceptional verbal and written communication skills.
Limited immigration sponsorship may be available.
Ability to travel 10%, on average, based on the work you do and the clients and industries/sectors you serve.


Preferred


Analytical/ Decision Making Responsibilities
Proficiency with Tableau desirable
Analytical ability to manage multiple projects and prioritize tasks into manageable work products.
Can operate independently or with minimum supervision.
Excellent Written and Communication Skills
Ability to deliver technical demonstrations.


For individuals assigned and/or hired to work in California, Colorado, Jersey City, New York City, and Washington State, Deloitte is required by law to include a reasonable estimate of the compensation range for this role. This compensation range is specific to California, Colorado, Jersey City, New York City, and Washington State and takes into account the wide range of factors that are considered in making compensation decisions including but not limited to skill sets; experience and training; licensure and certifications; and other business and organizational needs. At Deloitte, it is not typical for an individual to be hired at or near the top of the range for their role and compensation decisions are dependent on the facts and circumstances of each case. A reasonable estimate of the current range is $97,875-180,000."
