Title,Link,ID,Date,Description
Sr. Data Scientist,https://www.indeed.com/rc/clk?jk=d565b6f4d35a2744&fccid=68ec8a8ee6cf5ac6&vjs=3,job_d565b6f4d35a2744,28 days ago,"We’re Hiring a Senior Data Scientist!

If you are excited and passionate about helping #LetsSolveWater, consider joining our team today! Xylem, Inc. is a leading global water technology company servicing more than 150 countries and is dedicated to solving the world’s most challenging water issues. We are looking for individuals to join our mission by exceeding customer expectations through smart sustainable solutions. At Xylem, you will have the opportunity to solve water by participating in our paid Volunteer Program, Xylem Watermark!
The Role:
Xylem is seeking candidates with a background in Engineering, Physical/Mathematical Sciences, Computer Science, or Data Science, coupled with relevant practical experience developing numerical algorithms and related software products, to join our team as a Sr. Data Scientist in North America. As a member of the Data Science team, the incumbent will design, develop and test predictive models for water systems to integrate with data services and support Digital Intelligence solutions and technologies. The successful candidate will demonstrate the ability to develop scalable algorithms that are performant and provide clear value to the water industry. The ideal candidate will have a clear understanding of the data science product lifecycle, from R&D to development and delivery of production services. Candidates who also have valuable experience in the water analytics space are especially encouraged to apply, including water infrastructure systems and water treatment. The Xylem data science team is deeply involved in developing on-line predictive models and digital twins of water/wastewater treatment processes and water distribution and collection systems, using various numerical analysis and optimization algorithms, and AI/machine learning models; the successful candidate will demonstrate a clear ability to contribute to, and lead, these ongoing and related new product development efforts.
Essential Duties/Principal Responsibilities:
Develop well-architected data-driven and physics-based models, using statistical data analysis, mathematical optimization, machine learning, or parametric and non-parametric statistical models and techniques, that will empower Digital Intelligence Solutions’ products. Deliver products with strong attention to detail and accuracy
Digest and understand a range of practical and theoretical knowledge about water quality and treatment processes, including but not limited to coagulation, flocculation, sedimentation, filtration, disinfection, adsorption, and membrane processes. Interact with team members to stay updated on industry regulations and standards related to water treatment to ensure that all processes and product development adhere to these requirements.
Proven abilities in technical writing and verbal communication. Responsible for communicating analytics model behavior/results with clarity and accuracy.
Write technical documentation to support software product development during the conceptual R&D, architecture/planning, and implementation phases (Markdown, LaTex, etc).
Ensure the implementation of best practices for data science, including code development, model training, and validation/testing using MLOps.
Responsible for the design of algorithms that integrate different models/methods
Embody and instill in others a creative energy to build game-changing analytics tools that will lead the industry.
Lead data science projects from ideation to production. This involves working closely with product management to understand the business requirements and direction of the product and consider any existing models that have been built and assess their suitability for the product.
Responsible for building proper unit tests to ensure accuracy and robustness of all model components.
Strong sense of ownership to complete all product deliverables.
Enjoy working in a fast-paced, fun, and agile environment.
Minimum Qualifications: Education, Experience, Skills, Abilities, License/Certification:
Master of Science degree or higher in Engineering, Computer Science, Applied Mathematics/Statistics, Physics, Chemistry, Bioinformatics, or Data Science.
A background of 4-5 years in relevant applied work experience – e.g. applications for design and operation of water and wastewater infrastructure and treatment, electrical power generation and distribution, or industrial chemical process systems.
Proficiency in utilizing machine learning packages and tools such as Scikit-learn, TensorFlow, Keras, and other similar frameworks to develop, implement, and fine-tune machine learning models for various applications and projects.
Understanding of the operational intricacies and hydraulic dynamics inherent to water systems, coupled with the capability to create new algorithms using existing process modeling packages and APIs that are widely used in the water industry. This could entail, for example, developing a deep understanding of water flow, pressure, and distribution within these systems in order to translate this knowledge into practical software solutions for modeling and analyzing complex infrastructure systems and operational scenarios.
Demonstrated experience in building real-world data science models using Python or a comparable programming language is highly valued. The ability to transition these data science models into fully functional software products within the Python ecosystem is regarded as an additional asset. This entails not only creating effective models but also having the proficiency to integrate them seamlessly into software applications, contributing to the development of data-driven software solutions.
A strong aptitude for collaborative teamwork within a dynamic environment comprising data scientists and engineers. This includes the capacity to communicate effectively, share insights, and jointly tackle complex challenges. The ability to harness collective expertise and foster a cooperative spirit among team members is essential, as it contributes to the synergy required for the successful development, deployment, and refinement of data-driven solutions.
Preferred Qualifications:
Having proficiency in software usage is advantageous, particularly in domains closely tied to the data science product development cycle. Specific areas include:
Prior exposure to MLOps processes and familiarity with associated platforms like MLflow is considered an advantageous asset. Proficiency in MLOps implies a grasp of the end-to-end lifecycle management of machine learning models, encompassing model development, testing, deployment, monitoring, and continuous improvement.
Experience with software REST API design.
Proficiency in effectively utilizing the Git Workflow ecosystem or equivalent version control practices is essential. This encompasses a comprehensive understanding of version control practices, collaborative development workflows, and repository management within the Git ecosystem.
Demonstrated willingness and enthusiasm for acquiring proficiency in the expansive AWS Cloud ecosystem, including but not limited to understanding the nuances of cloud computing services, cloud-based model deployment procedures, and the practice of containerizing software models. This commitment to ongoing learning extends to staying abreast of the latest developments and best practices in cloud technology, ensuring seamless integration and deployment of machine learning models in a scalable and efficient manner.
Software systems such as Pyomo, which abstract the process of describing and solving mathematical optimization models for system identification and design/operational analysis
Relevant experience with software such as GPS-x and Biowin is a plus.

SALARY : The estimated salary range for this position is $115,000- $130,000 plus bonus. Starting pay is dependent on multiple factors, such as skills, experience and work location, and is not typically at the top of the range. At Xylem we offer a competitive compensation package with a generous benefit package, including Medical, Dental, Vision plans, 401(k) with company contribution, paid time off, paid parental leave and tuition reimbursement.

At Xylem, we embrace diversity and strive to create avenues where employees feel valued and appreciated through our DE&I initiatives and Employee Resources Groups (ERG). Xylem is proud to be an Equal Employment Opportunity and Affirmative Action workplace. Xylem prohibits discrimination, harassment of any kind and does not discriminate in employment on the basis of race, color, religion, sex or sexual orientation (including pregnancy and gender identity), national origin, political affiliation, marital status, medical conditions or disability, genetic information, age, or other non-merit factors.

Join the global Xylem team today! Xylem is a team creating advanced technology solutions to the world’s water challenges through developing new technologies and services that will improve the way water is used, conserved, and re-used in the future is central to our work. Our products and services move, treat, analyze, monitor, and return water to the environment, in public utility, industrial, residential, and commercial building services settings. Xylem also provides a leading portfolio of smart metering, network technologies and advanced analytics solutions for water, electric and gas utilities.

Disclaimer: The information listed within this job description is designed to indicate the general nature of work expected for this position and shall not be viewed as a comprehensive inventory of all duties, responsibilities, and qualifications required in this position. Employees must be able to perform the essential functions of the position satisfactorily and if requested, reasonable accommodations will be made to enable employees with disabilities to perform the essential functions of their job absent undue hardship. Xylem reserves the right to modify this job description or assign other duties to this position as needed."
Senior Inference Performance Architect - Deep Learning,https://www.indeed.com/rc/clk?jk=30ddfe87c7ce5e35&fccid=c267f29f0f85e8b8&vjs=3,job_30ddfe87c7ce5e35,,"We are now looking for a Deep Learning Performance Analysis Architect! NVIDIA is seeking outstanding Performance Analysis Architects to help analyze and accelerate AI application performance at the intersection of both hardware and software.
Intelligent machines powered by Artificial Intelligence that can learn, reason and interact with people are no longer science fiction. GPU Deep Learning has provided the foundation for machines to learn, perceive, reason and solve the world's most challenging problems. NVIDIA's GPUs excel at running AI algorithms, and act as the brains of computers, robots and self-driving cars that can perceive and understand the world.
What you’ll be doing:
Analyze performance and power efficiency of the most important deep learning inference workloads
Understand and analyze the interplay of hardware and software architectures on forward-looking algorithms, programming models and applications
Identify and prototype opportunities for performance optimization
Actively collaborate with software, product and research teams to guide the direction of deep learning HW and SW
What we need to see:
MS or PhD in a relevant discipline (CS, EE, CE) or equivalent experience
6+ years of relevant work/research experience
Solid foundation in machine learning and deep learning
Excellent programming skills in Python, C, C++
Strong background in computer architecture
Experience with performance modeling, architecture simulation, profiling, and analysis
A track record of creative solutions to technical challenges
Ways to stand out from the crowd:
CUDA programming skills
Background with deep neural network training, inference and optimization in leading frameworks (e.g. Pytorch, Tensorflow, TensorRT)
Experience with the architecture of or workload analysis on GPUs or other DL accelerators
Increasingly known as “the AI computing company”, NVIDIA wants you! Come join our Deep Learning Architecture team, where you can help build real-time, cost-effective computing platforms driving our success in this exciting and rapidly growing field.
The base salary range is $176,000 - $333,500. Your base salary will be determined based on your location, experience, and the pay of employees in similar positions.
You will also be eligible for equity and
benefits
.
NVIDIA is committed to fostering a diverse work environment and proud to be an equal opportunity employer. As we highly value diversity in our current and future employees, we do not discriminate (including in our hiring and promotion practices) on the basis of race, religion, color, national origin, gender, gender expression, sexual orientation, age, marital status, veteran status, disability status or any other characteristic protected by law.
#deeplearning"
Data Science Manager - Strategic Operations,https://www.indeed.com/rc/clk?jk=eb333d11e348ffea&fccid=4f07c74d0317cc39&vjs=3,job_eb333d11e348ffea,12 days ago,"The job details are as follows:
Apply knowledge of data analytics and applied sciences to collect and transform data, perform statistical modeling and analysis that will allow the managerial and executive staff of the organization to understand and react to the emerging data trends generated by the company’s operations in the pharmaceutical and biomedical research industry. Evaluate operational scenarios to make predictions on future outcomes and provide solutions and recommendations that support decision making. Conduct advanced analytics leveraging predictive modeling, machine learning, data mining and data visualization applied to large-scale structured and unstructured data; and design and build effective Tableau reports and dashboards to convey the key data points to the organization’s decision makers. Build pragmatic, scalable, and statistically rigorous models and solutions by leveraging or developing state-of-the-art statistical and machine learning methodologies, and employing relational database platforms (Microsoft Azure), and programming languages (SQL, Python). Collaborate with cross-functional teams of business operations and data analytics professionals to access and manipulate data, explain data gathering requirements, make recommendations, display results, and build efficient and scalable analytics solutions. Define, compute, track, and continuously validate business metrics with descriptive, predictive and prescriptive analytics. Architect, build and maintain data driven machine learning models, experiments, forecasting algorithms, and optimization models. Utilize Tableau to design, develop, enhance, and support Tableau visualizations including highly interactive dashboards, scorecards, and reports with drill down to detail and analysis pathways to other supporting reports.
TO APPLY: applications may be made through this Careers Page through November 1, 2023 thereafter resumes may be mailed to: United Therapeutics, Attn: A. Ridenhour - R03217, 55 TW Alexander Drive, Durham, NC 27709. Please reference Job Posting R03217.
Minimum Education and Experience Required
Master’s degree in an Operations Research, Computer Science, Data Analytics, or Business Administration field and 5 years of experience in the occupation of a Data Scientist or in a related Operations Research Analyst, Business Intelligence Analyst, or Business Data Analytics position.
As an alternative, a Bachelor’s degree in an Operations Research, Computer Science, Data Analytics, or Business Administration field and 7 years of experience in the occupation of Data Scientist or in a related Operations Research Analyst, Business Intelligence Analyst, or Business Data Analytics position will be acceptable.
Knowledge, Skills, and Abilities
3 years of experience building models and developing algorithms for machine learning.
3 years of experience designing relational data base solutions employing SQL Server or Microsoft Azure
3 years of experience employing Tableau to generate data visualizations and reports.
3 years of experience employing Python to develop data analytics solutions.
#LI-DNI
While United Therapeutics does not require vaccination for Covid-19 at this time, we strongly encourage all employees and visitors to remain up to date on vaccinations and boosters to protect one another from illness. Employees working in customer-facing roles must adhere and comply with customers’ credentialing guidelines, which may require vaccination against Covid -19, the influenza virus, and other illnesses that could be harmful to healthcare staff and patients.
United Therapeutics Corporation is an Equal Opportunity/Affirmative Action Employer - EOE Minorities / Females / Protected Veterans / Individuals with Disabilities"
Mid-Level Computer Vision Deep Learning Engineer,https://www.indeed.com/rc/clk?jk=54733ed7ae0155d3&fccid=600e6abd00b4b668&vjs=3,job_54733ed7ae0155d3,,"The Computer Vision and Remote Sensing Group at Applied Research Associates, Inc. (ARA) is looking for applied scientists and engineers to join our team operating at the forefront of Computer Vision technology applied to satellite imagery. Our group collaborates with world-renowned university researchers to find innovative solutions to challenging real-world problems. We offer an exciting, relevant research career within a stable industry work environment with opportunity for professional growth and mentorship.
In this role you will train, validate, and deploy deep networks operating on satellite imagery across the globe for modeling, object detection, and scene understanding. You will work in a team-oriented environment consisting of applied scientists, engineers, and software developers with frequent opportunities for cross-training and learning new technologies.
Mid-Level Computer Vision Deep Learning Engineer Qualifications:
US citizenship required (green card holders are not eligible for this position)
Eligibility to apply for and hold a U.S. security clearance (selected applicants will undergo a security investigation and must meet eligibility requirements at the time of employment)
Relocation to the Raleigh, NC metropolitan area required
Strong understanding of machine learning theory and practice (e.g., supervised vs. unsupervised learning, regularization, gradient descent, linear regression)
Experience training and applying deep networks to imagery for Computer Vision applications
Solid mathematical background in linear algebra and probability theory
Programming experience in Python and/or C++
Team player able to communicate technical results effectively to others
Mid-Level Computer Vision Deep Learning Engineer Education and Experience Qualifications:
MS Degree with 5 years of relevant experience in Computer Science, Electrical Engineering, or similar technical field OR Ph.D. with 2 years of relevant experience
Please see our similar career postings in the Computer Vision and Remote Sensing group for other experience levels (Staff, Senior)
Who is ARA?
Do you want to work for a purpose? Applied Research Associates, Inc. (aka ARA) is an employee-owned international research and engineering company. We have been providing technically superior solutions to complex and challenging problems in the physical sciences since 1979. ARA has over 2,013 employee owners and continues to grow rapidly. Together, our offices throughout the U.S. and Canada provide a broad range of technical expertise in defense, civil, and health technologies, computer software and simulation, systems analysis, environmental technologies, and testing and measurement.
ARA also prides itself, on having a challenging culture where innovation & experimentation are the norm. The motto, “Engineering and Science for Fun and Profit” sums up the ARA experience. Employee ownership ensures you have a voice with what happens in the company. We are also very proud of our Women’s Initiative Network (WIN), whose purpose is to motivate, support, and encourage professional career development for women to maximize career and professional accomplishments.
To find out more about what the Intelligence, Surveillance & Reconnaissance Division has to offer, visit our website at: https://www.ara.com/benefits/
Experience
Required
5 year(s): Relevant Work Experience
Education
Required
Masters or better in Computer Science or related field
Equal Opportunity Employer/Protected Veterans/Individuals with Disabilities
The contractor will not discharge or in any other manner discriminate against employees or applicants because they have inquired about, discussed, or disclosed their own pay or the pay of another employee or applicant. However, employees who have access to the compensation information of other employees or applicants as a part of their essential job functions cannot disclose the pay of other employees or applicants to individuals who do not otherwise have access to compensation information, unless the disclosure is (a) in response to a formal complaint or charge, (b) in furtherance of an investigation, proceeding, hearing, or action, including an investigation conducted by the employer, or (c) consistent with the contractor’s legal duty to furnish information. 41 CFR 60-1.35(c)"
Machine Learning Engineer - Hybrid,https://www.indeed.com/company/Inclusively/jobs/Machine-Learning-Engineer-c14429ea7e20a8ad?fccid=ef49cdc7b08c5254&vjs=3,job_c14429ea7e20a8ad,,"Inclusively is partnering with a multinational financial services company to hire a Machine Learning Engineer - Hybrid.
ABOUT INCLUSIVELY:
Inclusively is a digital tech platform that connects candidates with disabilities, who may benefit from workplace accommodations, to inclusive employers. This includes all disabilities under the ADA, including mental health conditions (e.g. anxiety, depression, PTSD), chronic illnesses (e.g. diabetes, Long COVID), and neurodivergence (e.g. autism, ADHD). Applicants with one or more of these conditions are encouraged to apply; Inclusively does not require applicants to disclose their specific disability.
The Role
The FI Data & Analytics Technology team is seeking an enthusiastic Machine Learning Engineer to work on AI/ML solutions in support of our FI Business partners.
Our team provides modern cloud-based data solutions for the broader FI organization that enables the Sales, Marketing, Finance, and AI/ML Analytics capabilities. This role will be a key contributor of solutions that support the Data Science Agile teams in the FI Advanced Analytics Solutions Product Area. As a Machine Learning Engineer, you will be responsible for developing cloud “infrastructure as code” components, shared Python frameworks, and data pipelines that integrate AI/ML model predictions with employee and customer facing applications.
As a Software Engineer focused on AI/ML Model training and inference pipelines, you will utilize your technical capabilities along with your domain expertise to develop innovative solutions. You have a passion for delivering business value through technology designs in an environment that will give you opportunities to grow in both the data and analytics domain.
The Expertise and Skills You Bring
Bachelor’s Degree or equivalent in a technology related field (e.g. Computer Science, Engineering, etc.)
6+ years of hands-on experience in one or more object-oriented programming languages (Java, Python)
1+ years of experience developing solutions on the AWS cloud platform.
AWS Developer or Solution Architect certification preferred.
Proven experience with continuous integration & delivery (CI/CD) practices and tools (Git, Jenkins, uDeploy).
Proven experience with building container-based systems such as Docker.
Proven experience with relational and dimensional data modeling techniques.
Exposure to AWS SageMaker and related AI/ML platform offerings.
Proven knowledge of AWS data solutions S3, Athena, RDS, DynamoDB, Kinesis, etc.
Proven experience or strong interest in machine learning models and concepts: regression, random forest, boosting, CRFs, MRFs, and deep learning.
Proven experience or strong interest in developing and deploying complex and scalable software systems in the analytics space.
Experience with Snowflake or other cloud data warehousing solutions.
Exposure with orchestration and scheduling tools (Control-M)
Proven experience with triaging, troubleshooting, and fixing issues in Production environments
Excellent communication skills including written, verbal, and technology diagrams.
Understanding of the model development lifecycle and has had exposure to DevOps/MLOps
Capable of working independently
Capable of leading and mentoring junior engineers in an agile environment
The Team
The Data & Analytics Technology team develops and supports data-intensive applications in support of data lake and analytical data needs. This role will focus on advanced analytics solutions while bringing software engineering discipline and support to the FI Data Science Agile teams. This is a critical position that will contribute to scaling the delivery of AI/ML models that contribute to driving One FI business success. Institutional is a suite of businesses and support groups that offers financial professionals and institutions access to the products, services, and investments they need to service their clients and grow their businesses.
Job Type: Full-time
Schedule:
Monday to Friday
Work Location: In person"
