Title,Link,ID,Date,Description
Principal Data Scientist,https://www.indeed.com/company/Lucid-Technologies/jobs/Principal-Scientist-9ee43d5d92e7b64f?fccid=286c6b679dae957b&vjs=3,job_9ee43d5d92e7b64f,,"Job Title: Consultant SME (Principal Data Scientist-Data Bricks)
Job Title: IT - Consultant V
Location work will be performed: NCO031 - Raleigh
Local to the Raleigh, NC area is preferred, a remote resource will be considered.
Description:
Our client is seeking a resource well skilled in Cloud support/Databricks to help meet organization priorities. Resume template required for submissions.
As a technical expert, provides advice and assistance in state-of the-art software/hardware solutions involving hardware of various capacities, multiple operating environments, database management systems specialized software, data communications facilities and protocols including Value Added Networks, fourth generation technologies, and complex software tools or packages. As a business expert, works with senior client officials to identify enterprise improvement goals, assess organizational and process effectiveness, and implement change strategies.
Roles and Responsibilities include but not limited to:
Designs technical and business solutions, mentors, and trains client staff, and oversees implementation.
Highly diverse technical and industry experience related to studying and analyzing system’s needs, systems development, and systems process analysis, design, and reengineering.
Possesses skills and experience related to business management, systems engineering, operations research, and management engineering. Typically has specialization in a particular technology or business application. Keeps abreast of technological developments and industry trends.
Assist with deployment, configuration, and management Azure Cloud environment.
Assist with migration efforts of existing ETL jobs into Azure/Databricks cloud environment.
Assist ETL staff with following best practices for Cloud, maximizing efficiency of cloud resources, and general knowledge sharing of cloud expertise with AA Cloud Staff
Assist with Operationalizing deployments and support of Cloud services for ETL Operations. This will include standardizing and automating processes and workflows, creating documentation/knowledge articles, and overall assist Operations staff who have limited experience in Cloud.
Written and oral presentation to high level Client CIO management on statues of current efforts
Basic Qualifications:
Strong skills and experience in regard to Cloud Operations support in Azure.
Strong Experience supporting large scale/enterprise level Cloud environments.
Strong Experience supporting several cloud services related to compute, network, databases, etc.…
Experience in using Databricks or other Spark-based platforms.
Knowledge of or experience in using any of the following: Sqoop, Oozie, Flume
Fluency in at least one scripting language (Python, Perl, Ruby or equivalent)
Ability to troubleshoot cloud resource problems and perform complex system tests.
Develop and maintain accurate documentation for internal procedures and services.
Ability to automate solutions to repetitive problems/tasks.
Ability to use a wide variety of open-source technologies and cloud services.
Integration of Git, in continuous deployment
Experience with DevOps monitoring tools
Knowledge of best practices and IT operations in an always-up, always-available service
Creative thinking skills
Detail-oriented personality
Ability to communicate well to other members of the development team.
Desired Skills:
Strong understanding of cloud networking at scale
Ability to break down complex networking concepts and present them in a concise way.
Shell scripting experience
PowerShell
Data Transfer:
The selected resource will be required to conduct knowledge-transfer sessions as necessary to share best practices and template code/scripts in each of the following areas:
Monitoring (Infrastructure and Application-specific)
Troubleshooting
Incident Alerting
Incident Avoidance
Development of dashboards
Settings and configuration
Security
How to test the platform and/or application(s)
Preparing audit compliance reports
Reporting:
Expertise producing and deliver of monthly status reports to inform the Client of its progress and identify any anticipated problems. The progress reports shall include, but are not limited to, the following:
Work progress
Identified risks or technical issues with associated recommendations and proposed contingency.
Schedule deviations and proposed plans to recover.
Preferred Qualifications:
Master's degree in related field
Minimum 10 year’s IT Architecture/Systems experience
Significant experience with SAS, Python, C++, Hadoop, SQL Database/Coding, Apache Spark, Machine Learning, Natural Language Processing, and visualization tools such as Tableau
Demonstrated experience working with unstructured data.
Additional Provisions:
Must be able to obtain a Position of Public Trust Clearance
Pass both a client mandated clearance process to include drug screening, criminal history check and credit check.
Once candidate’s resume is approved and interview passed, the agency is responsible for providing drug screening. Failure to submit the drug screening results will delay the security clearance process.
If a candidate is given an interim clearance, continuation of employment is then based on the candidate receiving a sensitive clearance.
All candidates must be a US Citizen or have permanent residence status (Green Card).
Candidate must have lived in the United States for the past 5 years.
Cannot have more than 6 months travel outside the United States within the last five years. Military Service excluded. (Exception does not include military family members.)
All overtime must be pre-approved in writing by the client manager or his/her designated representative.
Agency will not be reimbursed for overtime charges without previous written authorization. Authorized overtime will be reimbursed at straight time.
Job Type: Contract
Salary: $107,458.37 - $154,924.42 per year
Schedule:
8 hour shift
Ability to commute/relocate:
Raleigh, NC 27601: Reliably commute or planning to relocate before starting work (Required)
Experience:
Python: 1 year (Preferred)
SQL: 1 year (Preferred)
Work Location: In person"
AI Software Engineer,https://www.indeed.com/rc/clk?jk=5abdfccc11642e3d&fccid=915b1c0ee87e5e8a&vjs=3,job_5abdfccc11642e3d,,"Summary:
AI Software Engineer responsible for research/analysis, design, implementation, and unit testing to produce high-quality code for a team working on AI solutions for assessment technology platforms. The Engineer will be working with a team of high-performing professionals and should use industry best practices.
This position is part of the Pearson School Assessment team, which develops innovative assessment technology platforms. We are enriching Pearson’s assessments with AI capabilities that scale for multiple disciplines and grades.
Location : Remote within the United States
Team:
The leadership team is looking for developers that thrive on developing cutting edge applications, with a passion for innovation and pride in producing excellent user experiences. Our work environment is collaborative, flexible and results driven. The Senior Software Engineer will:
Analyze & Design – Collaborate with product team to understand requirements and deliverables.
Implement & Perform – Use industry standard design patterns and cloud first solutions. Focus on producing high quality, well-tested code using coding best practices.
Review – Contribute to code reviews.
Test & Deployment – Work on writing unit, integration tests. Work on deploying well tested software using CI/CD.
Quality/process improvement - Participate in group improvement activities and initiatives to improve process and product quality in pursuit of excellence.
Required Education and Experience:
Bachelor’s degree in computer science, MIS, or equivalent technology discipline.
3+ years relevant software development experience creating SaaS applications.
Experience with development, maintenance, and testing of software following industry best practices.
Experience with highly available, highly concurrent web-based applications.
Required Technical Skills:
Amazon Cloud.
Python, Django/Flask/ORM, Database technologies (RDS, Document, Graphs, Key Value).
Data Engineering.
Machine Learning algorithms.
Unit testing frameworks.
API’s and microservices.
Docker
Desired Experience:
3+ years’ experience working in an agile environment.
Able to think technically and analytically.
Ability to understand the philosophy of architecture.
Must be a self-starter and detail oriented.
Effective written and verbal communication skills
Ability to collaborate effectively within a team.
Compensation at Pearson is influenced by a wide array of factors including but not limited to skill set, level of experience, and specific location. As required by the Colorado, California, Washington State, New York State and New York City laws, the pay range for this position is as follows:
The minimum full-time salary range is between $110k -130k.
This position is eligible to participate in an annual incentive program, and information on benefits offered is here.
What to expect from Pearson
Did you know Pearson is one of the 10 most innovative education companies of 2022?
At Pearson, we add life to a lifetime of learning so everyone can realize the life they imagine. We do this by creating vibrant and enriching learning experiences designed for real-life impact. We are on a journey to be 100 percent digital to meet the changing needs of the global population by developing a new strategy with ambitious targets. To deliver on our strategic vision, we have five business divisions that are the foundation for the long-term growth of the company: Assessment & Qualifications, Virtual Learning, English Language Learning, Workforce Skills and Higher Education. Alongside these, we have our corporate divisions: Digital & Technology, Finance, Global Corporate Marketing & Communications, Human Resources, Legal, Strategy and Direct to Consumer. Learn more at We are Pearson.
We value the power of an inclusive culture and also a strong sense of belonging. We promote a culture where differences are embraced, opportunities are accessible, consideration and respect are the norm and all individuals are supported in reaching their full potential. Through our talent, we believe that diversity, equity and inclusion make us a more innovative and vibrant place to work. People are at the center, and we are committed to building a workplace where talent can learn, grow and thrive.
Pearson is an Affirmative Action and Equal Opportunity Employer and a member of E-Verify. We want a team that represents a variety of backgrounds, perspectives and skills. The more inclusive we are, the better our work will be. All employment decisions are based on qualifications, merit and business need. All qualified applicants will receive consideration for employment without regard to race, ethnicity, color, religion, sex, sexual orientation, gender identity, gender expression, age, national origin, protected veteran status, disability status or any other group protected by law. We strive for a workforce that reflects the diversity of our communities.
To learn more about Pearson’s commitment to a diverse and inclusive workforce, navigate to: Diversity, Equity & Inclusion at Pearson.
If you are an individual with a disability and are unable or limited in your ability to use or access our career site as a result of your disability, you may request reasonable accommodations by emailing ppsmhr@pearson.com.
Note that the information you provide will stay confidential and will be stored securely. It will not be seen by those involved in making decisions as part of the recruitment process.
Job: TECHNOLOGY
Organization: Assessment & Qualifications
Schedule: FULL\_TIME
Req ID: 13566
\#location"
Geospatial Data Scientist II,https://www.indeed.com/rc/clk?jk=2bf962dfeb75ece9&fccid=bafa4b35e9cd20ce&vjs=3,job_2bf962dfeb75ece9,6 days ago,"Company Description

Work with Us. Change the World.
At AECOM, we're delivering a better world. Whether improving your commute, keeping the lights on, providing access to clean water, or transforming skylines, our work helps people and communities thrive. We are the world's trusted infrastructure consulting firm, partnering with clients to solve the world’s most complex challenges and build legacies for future generations.
There has never been a better time to be at AECOM. With accelerating infrastructure investment worldwide, our services are in great demand. We invite you to bring your bold ideas and big dreams and become part of a global team of nearly 50,000 planners, designers, engineers, scientists, digital innovators, program and construction managers and other professionals delivering projects that create a positive and tangible impact around the world.
We're one global team driven by our common purpose to deliver a better world. Join us.

Job Description

AECOM is actively seeking a highly talented, energetic technology minded professional for immediate employment in the Raleigh, North Carolina office or nationwide. The Geospatial Data Scientist will report to the Mobile Technology & Remote Sensing Manager in the Technology Services Group and support both internal and external clients within the Environment Business line. This position will support a wide variety of AECOM projects including environmental permitting, natural disaster recovery, environmental restoration, construction, site assessments, inspections, energy infrastructure development, water resources, transportation, and more. A successful candidate will work both independently and in close coordination with various AECOM staff and project teams to develop, deploy and support GIS and other Geospatial Data Science critical to successful project delivery.
Responsibilities include, but are not limited to:
Gather and review technical requirements to meet data collection, development standards and implement quality assurance procedures.
Design, deploy and manage geospatial data collection reporting applications using data collected in ArcGIS Fields, Collector, Survey123, Workforce, and Dashboards within AGOL (ArcGIS Online).
Prepare and deploy dashboard applications with R (Shiny), Power Bi, or Tableau
Work with AI and Machine Learning leads to develop and implement geospatial analysis models.
Utilize Python, Model Builder, Microsoft Power Automate, Microsoft Flow and other commonly used scripting tools to automate workflows and streamline routine processes and tasks.
Work with team to manage and deploy data analytic reporting in addition to dashboarding.
Maintain quality assurance of spatial and non-spatial data and processes as per defined standards.
Maintain expertise in existing and emerging GIS and data analytics related software and technologies.
Market GIS and data science and analytic services to internal and external clients.
Apply attention to detail with proactive and resourceful problem-solving skills.

Qualifications

Minimum Requirements
BA/BS + 2 years of experience or demonstrated equivalency of experience and/or education.
Bachelor's Degree in GIS, Computer Science, Geography, Social Science, Environmental Science, Data Science, Engineering, or related field.
Valid Driver’s License and must be able to pass AECOM’s Motor Vehicle Records review.
Due to the nature of work US citizenship is required.
Preferred Qualifications
Proficiency with applications such as R (Shiny), Power Bi, or Tableau.
Proficiency with Python Bootcamp, Data Structures and Statistics, Data Visualization, and Machine Learning.
Proficiency with interactive web-based geospatial mapping applications using QGIS, R, Tableau, and GitHub to present visualizations of data.
Background or certificate in Data Science.
Relevant professional and progressively responsible experience in Geostatistics, GIS, and GIS mobile/web systems.
Experience with ESRI’s ArcMap, ArcCatalog, ArcGIS Pro.
Experience with ArcGIS Online (AGOL) or Enterprise GIS Systems.
Experience with other Geospatial software’s such as GRASS, QGIS, etc.
Comfortable working outside and/or traveling occasionally to support field activities.
Comfortable working in a fast-paced multi-tasking environment.
Maintain expertise in existing and emerging geospatial software and technologies.
Understanding of relational database organization, design, and functionality.
Ability to learn and present best practices for data management including workflows, tools, governance models, and integration patterns.
Demonstrated knowledge of cartographic design and production concepts and principles.
FAA Part 107 sUAS Pilot Certificate and UAS flight experience.
Proficiency with UAS data processing applications such as Pix4D Mapper, Pix4DMatic, Agisoft Metashape, and cloud-based platforms such as DroneDeploy.

Additional Information
Relocation is not available for this position.
Sponsorship for US employment authorization is not available in the future for this position.
Offered rate of compensation ([insert state] locations only) will be based on individual education, qualifications, experience, and work location. The salary range for this position is $55,000 - $90,000.
AECOM is proud to offer a comprehensive benefits program to meet the diverse needs of our employees. Depending on your employment status, AECOM benefits may include medical, dental, vision, life, AD&D and disability benefits, paid time off, leaves of absence, voluntary benefits, perks, wellness and global well-being, and global EAP, Business Travel, and Service Awards programs.
About AECOM
AECOM is the world’s trusted infrastructure consulting firm, delivering professional services throughout the project lifecycle – from advisory, planning, design and engineering to program and construction management. On projects spanning transportation, buildings, water, new energy and the environment, our public- and private-sector clients trust us to solve their most complex challenges. Our teams are driven by a common purpose to deliver a better world through our unrivaled technical and digital expertise, a culture of equity, diversity and inclusion, and a commitment to environmental, social and governance priorities. AECOM is a Fortune 500 firm and its Professional Services business had revenue of $13.1 billion in fiscal year 2022. See how we are delivering sustainable legacies for generations to come at aecom.com and @AECOM.

Freedom to Grow in a World of Opportunity
You will have the flexibility you need to do your best work with hybrid work options. Whether you’re working from an AECOM office, remote location or at a client site, you will be working in a dynamic environment where your integrity, entrepreneurial spirit and pioneering mindset are championed.
You will help us foster a culture of equity, diversity and inclusion – a safe and respectful workplace, where we invite everyone to bring their whole selves to work using their unique talents, backgrounds and expertise to create transformational outcomes for our clients.
AECOM provides a wide array of compensation and benefits programs to meet the diverse needs of our employees and their families. We also provide a robust global well-being program. We’re the world’s trusted global infrastructure firm, and we’re in this together – your growth and success are ours too.
Join us, and you’ll get all the benefits of being a part of a global, publicly traded firm – access to industry-leading technology and thinking and transformational work with big impact and work flexibility. As an Equal Opportunity Employer, we believe in each person’s potential, and we’ll help you reach yours.
All your information will be kept confidential according to EEO guidelines."
Part-Time Data Scientist,https://www.indeed.com/rc/clk?jk=7383e9252656313f&fccid=c04c7b1b607f1cdc&vjs=3,job_7383e9252656313f,6 days ago,"Organization
U.S. Environmental Protection Agency (EPA)
Reference Code
epa-nssc-0009-54-10-24-23
How to Apply

Description
The EPA National Student Services Contract has an immediate opening for a part-time Data Scientist position with the Office of Research and Development at the EPA facility in Research Triangle Park, NC.
The Office of Research and Development at the EPA supports high-quality research to improve the scientific basis for decisions on national environmental issues and help EPA achieve its environmental goals. Research is conducted in a broad range of environmental areas by scientists in EPA laboratories and at universities across the country.
What the EPA project is about
The EPA Center for Computational Toxicology and Exposure (CCTE) is responsible for developing new computational tools and providing quantitative analysis for improving public health and environmental risk assessments and regulatory decisions pertaining to chemical safety. CCTE researchers integrate advances in biology, biotechnology, chemistry, and computer science to identify important biological processes that may be disrupted by the chemicals. The combined information helps prioritize chemicals based on potential human health risks. Using computational toxicology research, thousands of chemicals can be evaluated for potential risk at small cost in a very short amount of time.
EPA is responsible for ensuring the safety of thousands of chemicals but quantitative exposure data are available for only a small fraction of registered chemicals. As part of its ongoing efforts to support implementation of the Toxic Substance Act as revised by the Frank R. Lautenberg Chemical Safety for the 21st Century Act, EPA researchers are developing innovative methods to make exposure estimates for thousands of chemicals. These type of exposure data are combined with toxicity data to help thoroughly evaluate chemicals for potential health effects (https://www.epa.gov/chemical-research/rapid-chemical-exposure-and-dose-research).
What experience and skills will you gain?
As a team member, you will provide data management, data curation and data analysis support for EPA’s HTTK and ExpoCast project. This project focuses on analyzing a database of in vitro toxicokinetic data, application of machine learning techniques (e.g., Random Forest) to generate predictive models, and the creation of R packages to package and distribute the R code and data for re-use by others. Toxicokinetics describes the absorption, distribution, metabolism, and excretion of chemicals by the body. Toxicokinetic information is needed to understand the risks posed by chemicals in the environment to the public health. The team member will be a member of a multi-disciplinary research team and support the development, maintenance, and analysis of EPA’s HTTK and ExpoCast projects.
Data Development and Analysis responsibilities will include:
Implementation of machine learning techniques using caret (R) or and/or Sci-Kit learn (Python);
Preparation and quality control of data and workflows;
Creation of metadata and fact sheets supporting the data products; and
Literature review.
Communications-related responsibilities will include:
Participating as a member of a multi-disciplinary research team;
Interacting with other members of the development team as well as EPA scientists; and
Documenting code via Bitbucket and GitHub.
Required Knowledge, Skills, Work Experience, and Education
Strong written, oral, and electronic communication skills;
Experience programming in R or Python; and
Experience in machine learning.
Desired Knowledge, Skills, Work Experience, and Education
Experience in chemical informatics and
Experience documenting code via Bitbucket and/or Github.
Location: This job will be located EPA’s facility in Research Triangle Park, NC.
Salary: Selected applicant will become a temporary employee of ORAU and will receive an hourly wage of $28.52 for hours worked.
Hours: Part-time.
Travel: Travel will not be required.
Expected start date: The position is part time and expected to begin November 2023. The selected applicant will become a temporary employee of ORAU working as a contractor to EPA. The contract renews each May through 2025.
For more information, contact EPANSSC@orau.org. Do not contact EPA directly.
Qualifications
Be at least 18 years of age and
Have earned at least a bachelor’s degree in the fields of environmental science, chemistry, applied mathematics, computer science or a related field plus one year of graduate school from an accredited university or college within the last 24 months and
Be a citizen of the United States of America or a Legal Permanent Resident.
EPA ORD employees, their spouses, and children are not eligible to participate in this program.
Eligibility Requirements
Citizenship: LPR or U.S. Citizen
Degree: Any degree .
Discipline(s):
Chemistry and Materials Sciences
Computer, Information, and Data Sciences
Environmental and Marine Sciences
Mathematics and Statistics
Affirmation
I certify that I am at least 18 years of age; a recent graduate with at least a bachelor’s degree in the fields of environmental science, chemistry, applied mathematics, computer science or a related field plus one year of graduate school from an accredited university or college within the last 24 months; a citizen or a Legal Permanent Resident of the United States of America; and not a current employee of EPA ORD or the spouse or child of an EPA ORD employee.
ORAU is an Equal Opportunity Employer (EOE AA M/F/Vet/Disability); visit the ORAU website for required employment notices."
